{
  "schema_version": "1.0",
  "realms": [
    {
      "stage": "炼气一层",
      "requirements": ["完成基础引气入体"],
      "boundaries": ["只能使用基础吐纳和低强度术法"]
    },
    {
      "stage": "炼气二层",
      "requirements": ["小周天稳定", "能连续完成十二次基础灵气循环"],
      "boundaries": ["可施展低强度催芽诀，但连续施术会积累经脉负担"]
    },
    {
      "stage": "炼气三层",
      "requirements": ["木灵气逆冲伤势解除", "连续二十四次稳定小周天", "至少两枚下品灵石或等价灵气来源", "有监护记录"],
      "boundaries": ["只能提高控制稳定性，不能凭空增加药性知识或战斗能力"]
    }
  ],
  "resources": [
    {"resource_id": "low-spirit-stone", "unit": "枚", "rules": ["获得、消耗和余额必须逐章记录"]},
    {"resource_id": "contribution-point", "unit": "点", "rules": ["扣减、冻结和恢复继续使用同一资源 ID"]},
    {"resource_id": "healing-salve", "unit": "份", "rules": ["用于缓解木灵气逆冲，不能瞬间治愈"]},
    {"resource_id": "moon-dew", "unit": "瓶", "rules": ["药园公物，领取、用量和归还必须有记录"]}
  ],
  "techniques": [
    {
      "technique_id": "basic-breathing",
      "name": "基础吐纳",
      "effects": ["恢复少量灵气", "稳定小周天"],
      "limits": ["不能恢复裂根药材", "灵气紊乱时强行运转会加重伤势"]
    },
    {
      "technique_id": "micro-sprout-art",
      "name": "微量催芽诀",
      "effects": ["短时调节单株药苗生长方向", "适合低强度分段控制"],
      "limits": ["不能逆转已经裂根的损伤", "连续施术会触发 wood-qi-spasm", "伤势未解除前不得连续使用"]
    },
    {
      "technique_id": "herb-identification",
      "name": "辨药术",
      "effects": ["通过气味、叶脉和根纹判断药性变化"],
      "limits": ["不能判断谁移动过药签", "必须配合实物记录"]
    }
  ],
  "artifacts": [
    {"artifact_id": "dew-control-spout", "name": "控露陶嘴", "limits": ["公用器物，损坏需赔偿"]},
    {"artifact_id": "work-token", "name": "工时牌", "limits": ["只记录领取和归还时辰，不自动证明实际操作者"]}
  ],
  "injury_rules": [
    {
      "state_id": "wood-qi-spasm",
      "name": "木灵气逆冲",
      "symptoms": ["右臂手抖", "气息中断", "结印失稳"],
      "recovery": ["停止连续催芽", "使用疗伤膏", "完成稳定吐纳", "由巡验者确认"],
      "hard_rule": "部分恢复和最终解除必须使用同一 state_id"
    }
  ],
  "breakthrough_rules": [
    {
      "from_stage": "炼气二层",
      "to_stage": "炼气三层",
      "prerequisites": ["wood-qi-spasm 已解除", "二十四次稳定小周天", "有监护记录"],
      "costs": ["消耗至少两枚下品灵石或等价资源", "突破后三日不得连续催芽"],
      "new_limits": ["三日内不得连续使用催芽诀", "仍不能恢复裂根药材"]
    }
  ],
  "power_boundaries": [
    "本单元最高只能到炼气三层",
    "突破只提升控制稳定性，不提供破案能力",
    "告状藤复述不是修炼能力，也不是可靠证词",
    "任何药材恢复都必须服从根系是否完整"
  ],
  "exceptions": []
}
